
intent,pattern,response_type,response
bappenda_info,"kapan bappenda Tegal buka|bappenda tegal buka jam berapa|bappenda tegal buka jam?|jam berapa sih bappenda buka|bappenda tegal buka jam berapa|jadwal operasional bappenda tegal|kapan bappenda tegal buka|jam kerja bappenda tegal|layanan bappenda tegal sampai jam berapa|pukul berapa bappenda tegal beroperasi|info jam buka bappenda tegal|jam buka bappenda tegal|bappenda tegal tutup jam berapa|bappenda tegal melayani sampai pukul berapa|Kapan Kantor Pelayanan bappenda Tegal membuka layanannya?|KPP Tegal buka jam brp?|kntor pjak tegal buka jm brp?|Cek jadwal operasional KPP Tegal.|Bolehkah saya mengetahui jam operasional KPP Tegal?|bappenda Tegal buka dr jam brp?|kpan kntor bappenda tegal buka?|Info jam layanan KPP Pratama Tegal.|Pada pukul berapa KPP Tegal memulai operasionalnya?|Ada yg tau jadwal buka KPP Tegal?|bappenda tegal buka jam?|Akses jam kerja KPP Tegal.|Kapankah jam layanan KPP Tegal dimulai?|KPP Tegal jam berapa buka nya?|jam brp bappenda tegal?|Update jadwal buka KPP Tegal.|Bisakah Anda menyampaikan jadwal buka KPP Tegal?|Kalo mau ke KPP Tegal bukanya jam berapa?|kpp tegal buka jam?|Cek availability KPP Tegal.|Mohon informasikan jam kerja KPP Tegal.|KPP Tegal buka skrg?|jam buka bappenda tegal?|Jadwal customer service KPP Tegal.|Pukul berapa KPP Tegal tutup?|KPP Tegal tutup jam brp?|kpp tegal tutup jam brp?|Waktu tutup operasional KPP Tegal.|Sampai pukul berapa KPP Tegal melayani wajib bappenda?|KPP Tegal sampe jam berapa?|sampai jam brp kpp tegal?|Jam layanan KPP Tegal hari ini.|Apakah KPP Tegal buka pada hari ini?|KPP Tegal lg buka ga sih?|kpp tegal buka ga?|Status buka/tutup KPP Tegal real-time.|Dimana saya dapat menemukan jadwal KPP Tegal?|Link jadwal KPP Tegal dong.|link jadwal kpp tegal|.|Apakah ada perbedaan jam layanan di KPP Tegal?|Bedain jam layanan KPP Tegal dong.|beda jam layanan kpp tegal|Segmentasi jam layanan KPP Tegal.|Kapan waktu terbaik untuk mengunjungi KPP Tegal?|Wktu yg enak ke KPP Tegal kpn?|waktu enak ke kpp tegal|Rekomendasi slot waktu kunjung KPP Tegal.|Apakah jam operasional KPP Tegal berbeda di akhir pekan?|KPP Tegal buka di weekend ga?|kpp tegal weekend buka?|Jadwal weekend KPP Tegal.|Bagaimana prosedur layanan di KPP Tegal?|Klo mau urus bappenda di KPP Tegal gimana?|urus bappenda di kpp tegal gmn?|Tata cara layanan KPP Tegal.|Apakah KPP Tegal melayani di luar jam kerja?|KPP Tegal ada layanan after hour ga?|kpp tegal layanan after hour?|Layanan after hour KPP Tegal.Kapankah jam layanan bappenda Tegal dimulai?|bappenda Tegal jam berapa buka?|kntor bappenda tegal buka jam?|Cek jadwal operasional bappenda Tegal.|Bisakah saya mengetahui jadwal operasional bappenda Tegal?|bappenda Tegal buka dr jam brp?|bappenda tegal buka jam brp?|Info jam layanan bappenda Pratama Tegal.|Pada pukul berapa bappenda Tegal memulai kegiatannya?|Ada yg tau jadwal buka bappenda Tegal?|bappenda tegal buka kpn?|Akses jam kerja bappenda Tegal.|Mohon informasikan waktu kerja bappenda Tegal.|bappenda Tegal buka skrg?|bappenda tegal buka ga skrg?|Update status buka bappenda Tegal.|Sampai pukul berapa bappenda Tegal melayani?|bappenda Tegal sampe jam berapa?|bappenda tegal tutup jam?|Waktu tutup layanan bappenda Tegal.|Apakah bappenda Tegal buka pada hari Sabtu?|bappenda Tegal weekend buka ga?|bappenda tegal sabtu buka?|Jadwal weekend bappenda Tegal.|Dimana saya bisa melihat jadwal bappenda Tegal?|Bagaimana prosedur layanan di bappenda Tegal?|Klo mau bayar bappenda di Tegal gimana?|byr bappenda di tegal gmn?|Tata cara layanan bappenda Tegal.|Apakah ada layanan darurat di bappenda Tegal?|bappenda Tegal ada layanan cepat?|bappenda tegal layanan cepat?|Layanan ekspres bappenda Tegal.|Kapan waktu yang tepat untuk datang ke bappenda Tegal?|Wktu yg ga rame ke bappenda Tegal kpn?|wkt sepi ke bappenda tegal|Rekomendasi slot kunjung bappenda Tegal.|Apakah jam layanan KPP dan bappenda Tegal sama?|Beda ga jamnya KPP sama bappenda?|beda jam kpp sm bappenda?|Bisakah mendapatkan layanan bappenda Tegal secara online?|Bisa urus bappenda Tegal online ga?|urus bappenda tegal online?|Layanan digital bappenda Tegal.|Bagaimana kondisi antrian di bappenda Tegal?|Antrian di bappenda Tegal rame ga?|antrian bappenda tegal|Monitoring antrian bappenda Tegal.|Apakah bappenda Tegal tutup pada hari libur nasional?|bappenda Tegal libur nasional tutup kan?|bappenda tegal libur nasional?|Kalender libur bappenda Tegal.|kapan kantor bappenda Tegal buka|kantor bappenda tegal buka jam berapa|kantor bappenda tegal buka jam?|jam berapa sih kantor bappenda buka|kantor bappenda tegal buka jam berapa|jadwal operasional kantor bappenda tegal|kapan kantor bappenda tegal buka|jam kerja kantor bappenda tegal|layanan kantor bappenda tegal sampai jam berapa|pukul berapa kantor bappenda tegal beroperasi|info jam buka kantor bappenda tegal|jam buka kantor bappenda tegal|kantor bappenda tegal tutup jam berapa|kantor bappenda tegal melayani sampai pukul berapa|Kapan Kantor Pelayanan kantor bappenda Tegal membuka layanannya?|KPP Tegal buka jam brp?|kntor pjak tegal buka jm brp?|Cek jadwal operasional KPP Tegal.|Bolehkah saya mengetahui jam operasional KPP Tegal?|kantor bappenda Tegal buka dr jam brp?|kpan kntor kantor bappenda tegal buka?|Info jam layanan KPP Pratama Tegal.|Pada pukul berapa KPP Tegal memulai operasionalnya?|Ada yg tau jadwal buka KPP Tegal?|kantor bappenda tegal buka jam?|Akses jam kerja KPP Tegal.|Kapankah jam layanan KPP Tegal dimulai?|KPP Tegal jam berapa buka nya?|jam brp kantor bappenda tegal?|Update jadwal buka KPP Tegal.|Bisakah Anda menyampaikan jadwal buka KPP Tegal?|Kalo mau ke KPP Tegal bukanya jam berapa?|kpp tegal buka jam?|Cek availability KPP Tegal.|Mohon informasikan jam kerja KPP Tegal.|KPP Tegal buka skrg?|jam buka kantor bappenda tegal?|Jadwal customer service KPP Tegal.|Pukul berapa KPP Tegal tutup?|KPP Tegal tutup jam brp?|kpp tegal tutup jam brp?|Waktu tutup operasional KPP Tegal.|Sampai pukul berapa KPP Tegal melayani wajib kantor bappenda?|KPP Tegal sampe jam berapa?|sampai jam brp kpp tegal?|Jam layanan KPP Tegal hari ini.|Apakah KPP Tegal buka pada hari ini?|KPP Tegal lg buka ga sih?|kpp tegal buka ga?|Status buka/tutup KPP Tegal real-time.|Dimana saya dapat menemukan jadwal KPP Tegal?|Link jadwal KPP Tegal dong.|link jadwal kpp tegal|Apakah ada perbedaan jam layanan di KPP Tegal?|Bedain jam layanan KPP Tegal dong.|beda jam layanan kpp tegal|Segmentasi jam layanan KPP Tegal.|Kapan waktu terbaik untuk mengunjungi KPP Tegal?|Wktu yg enak ke KPP Tegal kpn?|waktu enak ke kpp tegal|Rekomendasi slot waktu kunjung KPP Tegal.|Apakah jam operasional KPP Tegal berbeda di akhir pekan?|KPP Tegal buka di weekend ga?|kpp tegal weekend buka?|Jadwal weekend KPP Tegal.|Bagaimana prosedur layanan di KPP Tegal?|Klo mau urus kantor bappenda di KPP Tegal gimana?|urus kantor bappenda di kpp tegal gmn?|Tata cara layanan KPP Tegal.|Apakah KPP Tegal melayani di luar jam kerja?|KPP Tegal ada layanan after hour ga?|kpp tegal layanan after hour?|Layanan after hour KPP Tegal.Kapankah jam layanan kantor bappenda Tegal dimulai?|kantor bappenda Tegal jam berapa buka?|kntor kantor bappenda tegal buka jam?|Cek jadwal operasional kantor bappenda Tegal.|Bisakah saya mengetahui jadwal operasional kantor bappenda Tegal?|kantor bappenda Tegal buka dr jam brp?|kantor bappenda tegal buka jam brp?|Info jam layanan kantor bappenda Pratama Tegal.|Pada pukul berapa kantor bappenda Tegal memulai kegiatannya?|Ada yg tau jadwal buka kantor bappenda Tegal?|kantor bappenda tegal buka kpn?|Akses jam kerja kantor bappenda Tegal.|Mohon informasikan waktu kerja kantor bappenda Tegal.|kantor bappenda Tegal buka skrg?|kantor bappenda tegal buka ga skrg?|Update status buka kantor bappenda Tegal.|Sampai pukul berapa kantor bappenda Tegal melayani?|kantor bappenda Tegal sampe jam berapa?|kantor bappenda tegal tutup jam?|Waktu tutup layanan kantor bappenda Tegal.|Apakah kantor bappenda Tegal buka pada hari Sabtu?|kantor bappenda Tegal weekend buka ga?|kantor bappenda tegal sabtu buka?|Jadwal weekend kantor bappenda Tegal.|Dimana saya bisa melihat jadwal kantor bappenda Tegal?|Link jadwal kantor bappenda Tegal dong.|link jadwal kantor bappenda tegal|Bagaimana prosedur layanan di kantor bappenda Tegal?|Klo mau bayar kantor bappenda di Tegal gimana?|byr kantor bappenda di tegal gmn?|Tata cara layanan kantor bappenda Tegal.|Apakah ada layanan darurat di kantor bappenda Tegal?|kantor bappenda Tegal ada layanan cepat?|kantor bappenda tegal layanan cepat?|Layanan ekspres kantor bappenda Tegal.|Kapan waktu yang tepat untuk datang ke kantor bappenda Tegal?|Wktu yg ga rame ke kantor bappenda Tegal kpn?|wkt sepi ke kantor bappenda tegal|Rekomendasi slot kunjung kantor bappenda Tegal.|Apakah jam layanan KPP dan kantor bappenda Tegal sama?|Beda ga jamnya KPP sama kantor bappenda?|beda jam kpp sm kantor bappenda?|Bisakah mendapatkan layanan kantor bappenda Tegal secara online?|Bisa urus kantor bappenda Tegal online ga?|urus kantor bappenda tegal online?|Layanan digital kantor bappenda Tegal.|Bagaimana kondisi antrian di kantor bappenda Tegal?|Antrian di kantor bappenda Tegal rame ga?|antrian kantor bappenda tegal|Monitoring antrian kantor bappenda Tegal.|Apakah kantor bappenda Tegal tutup pada hari libur nasional?|kantor bappenda Tegal libur nasional tutup kan?|kantor bappenda tegal libur nasional?|Kalender libur kantor bappenda Tegal.",static,jam layanan Bappenda setiap hari senin-jumat pukul 08.00 - 14.00 WIB
kpp_info,"kpp tegal buka jam berapa?|kapan kantor pajak Tegal buka|kantor pajak tegal buka jam berapa|kantor pajak tegal buka jam?|jam berapa sih kantor pajak buka|kantor pajak tegal buka jam berapa|jadwal operasional kantor pajak tegal|kapan kantor pajak tegal buka|jam kerja kantor pajak tegal|layanan kantor pajak tegal sampai jam berapa|pukul berapa kantor pajak tegal beroperasi|info jam buka kantor pajak tegal|jam buka kantor pajak tegal|kantor pajak tegal tutup jam berapa|kantor pajak tegal melayani sampai pukul berapa|Kapan Kantor Pelayanan Pajak Tegal membuka layanannya?|KPP Tegal buka jam brp?|kntor pjak tegal buka jm brp?|Cek jadwal operasional KPP Tegal.|Bolehkah saya mengetahui jam operasional KPP Tegal?|Kantor pajak Tegal buka dr jam brp?|kpan kntor pajak tegal buka?|Info jam layanan KPP Pratama Tegal.|Pada pukul berapa KPP Tegal memulai operasionalnya?|Ada yg tau jadwal buka KPP Tegal?|kantor pajak tegal buka jam?|Akses jam kerja KPP Tegal.|Kapankah jam layanan KPP Tegal dimulai?|KPP Tegal jam berapa buka nya?|jam brp kantor pajak tegal?|Update jadwal buka KPP Tegal.|Bisakah Anda menyampaikan jadwal buka KPP Tegal?|Kalo mau ke KPP Tegal bukanya jam berapa?|kpp tegal buka jam?|Cek availability KPP Tegal.|Mohon informasikan jam kerja KPP Tegal.|KPP Tegal buka skrg?|jam buka kantor pajak tegal?|Jadwal customer service KPP Tegal.|Pukul berapa KPP Tegal tutup?|KPP Tegal tutup jam brp?|kpp tegal tutup jam brp?|Waktu tutup operasional KPP Tegal.|Sampai pukul berapa KPP Tegal melayani wajib pajak?|KPP Tegal sampe jam berapa?|sampai jam brp kpp tegal?|Jam layanan KPP Tegal hari ini.|Apakah KPP Tegal buka pada hari ini?|KPP Tegal lg buka ga sih?|kpp tegal buka ga?|Status buka/tutup KPP Tegal real-time.|Dimana saya dapat menemukan jadwal KPP Tegal?|Link jadwal KPP Tegal dong.|link jadwal kpp tegal|.|Apakah ada perbedaan jam layanan di KPP Tegal?|Bedain jam layanan KPP Tegal dong.|beda jam layanan kpp tegal|Segmentasi jam layanan KPP Tegal.|Kapan waktu terbaik untuk mengunjungi KPP Tegal?|Wktu yg enak ke KPP Tegal kpn?|waktu enak ke kpp tegal|Rekomendasi slot waktu kunjung KPP Tegal.|Apakah jam operasional KPP Tegal berbeda di akhir pekan?|KPP Tegal buka di weekend ga?|kpp tegal weekend buka?|Jadwal weekend KPP Tegal.|Bagaimana prosedur layanan di KPP Tegal?|Klo mau urus pajak di KPP Tegal gimana?|urus pajak di kpp tegal gmn?|Tata cara layanan KPP Tegal.|Apakah KPP Tegal melayani di luar jam kerja?|KPP Tegal ada layanan after hour ga?|kpp tegal layanan after hour?|Layanan after hour KPP Tegal.Kapankah jam layanan kantor pajak Tegal dimulai?|Kantor pajak Tegal jam berapa buka?|kntor pajak tegal buka jam?|Cek jadwal operasional kantor pajak Tegal.|Bisakah saya mengetahui jadwal operasional kantor pajak Tegal?|Pajak Tegal buka dr jam brp?|pajak tegal buka jam brp?|Info jam layanan kantor pajak Pratama Tegal.|Pada pukul berapa kantor pajak Tegal memulai kegiatannya?|Ada yg tau jadwal buka kantor pajak Tegal?|pajak tegal buka kpn?|Akses jam kerja kantor pajak Tegal.|Mohon informasikan waktu kerja kantor pajak Tegal.|Kantor pajak Tegal buka skrg?|pajak tegal buka ga skrg?|Update status buka kantor pajak Tegal.|Sampai pukul berapa kantor pajak Tegal melayani?|Pajak Tegal sampe jam berapa?|pajak tegal tutup jam?|Waktu tutup layanan kantor pajak Tegal.|Apakah kantor pajak Tegal buka pada hari Sabtu?|Pajak Tegal weekend buka ga?|pajak tegal sabtu buka?|Jadwal weekend kantor pajak Tegal.|Dimana saya bisa melihat jadwal kantor pajak Tegal?|Link jadwal kantor pajak Tegal dong.|link jadwal pajak tegal|Bagaimana prosedur layanan di kantor pajak Tegal?|Klo mau bayar pajak di Tegal gimana?|byr pajak di tegal gmn?|Tata cara layanan kantor pajak Tegal.|Apakah ada layanan darurat di kantor pajak Tegal?|Pajak Tegal ada layanan cepat?|pajak tegal layanan cepat?|Layanan ekspres kantor pajak Tegal.|Kapan waktu yang tepat untuk datang ke kantor pajak Tegal?|Wktu yg ga rame ke pajak Tegal kpn?|wkt sepi ke pajak tegal|Rekomendasi slot kunjung kantor pajak Tegal.|Apakah jam layanan KPP dan kantor pajak Tegal sama?|Beda ga jamnya KPP sama kantor pajak?|beda jam kpp sm kantor pajak?|Bisakah mendapatkan layanan pajak Tegal secara online?|Bisa urus pajak Tegal online ga?|urus pajak tegal online?|Layanan digital kantor pajak Tegal.|Bagaimana kondisi antrian di kantor pajak Tegal?|Antrian di pajak Tegal rame ga?|antrian pajak tegal|Monitoring antrian kantor pajak Tegal.|Apakah kantor pajak Tegal tutup pada hari libur nasional?|Pajak Tegal libur nasional tutup kan?|pajak tegal libur nasional?|Kalender libur kantor pajak Tegal.|kapan kantor PDAM Tegal buka|kantor PDAM tegal buka jam berapa|kantor PDAM tegal buka jam?|jam berapa sih kantor PDAM buka|kantor PDAM tegal buka jam berapa|jadwal operasional kantor PDAM tegal|kapan kantor PDAM tegal buka|jam kerja kantor PDAM tegal|layanan kantor PDAM tegal sampai jam berapa|pukul berapa kantor PDAM tegal beroperasi|info jam buka kantor PDAM tegal|jam buka kantor PDAM tegal|kantor PDAM tegal tutup jam berapa|kantor PDAM tegal melayani sampai pukul berapa|Kapan Kantor Pelayanan kantor PDAM Tegal membuka layanannya?|KPP Tegal buka jam brp?|kntor pjak tegal buka jm brp?|Cek jadwal operasional KPP Tegal.|Bolehkah saya mengetahui jam operasional KPP Tegal?|kantor PDAM Tegal buka dr jam brp?|kpan kntor kantor PDAM tegal buka?|Info jam layanan KPP Pratama Tegal.|Pada pukul berapa KPP Tegal memulai operasionalnya?|Ada yg tau jadwal buka KPP Tegal?|kantor PDAM tegal buka jam?|Akses jam kerja KPP Tegal.|Kapankah jam layanan KPP Tegal dimulai?|KPP Tegal jam berapa buka nya?|jam brp kantor PDAM tegal?|Update jadwal buka KPP Tegal.|Bisakah Anda menyampaikan jadwal buka KPP Tegal?|Kalo mau ke KPP Tegal bukanya jam berapa?|kpp tegal buka jam?|Cek availability KPP Tegal.|Mohon informasikan jam kerja KPP Tegal.|KPP Tegal buka skrg?|jam buka kantor PDAM tegal?|Jadwal customer service KPP Tegal.|Pukul berapa KPP Tegal tutup?|KPP Tegal tutup jam brp?|kpp tegal tutup jam brp?|Waktu tutup operasional KPP Tegal.|Sampai pukul berapa KPP Tegal melayani wajib kantor PDAM?|KPP Tegal sampe jam berapa?|sampai jam brp kpp tegal?|Jam layanan KPP Tegal hari ini.|Apakah KPP Tegal buka pada hari ini?|KPP Tegal lg buka ga sih?|kpp tegal buka ga?|Status buka/tutup KPP Tegal real-time.|Dimana saya dapat menemukan jadwal KPP Tegal?|Link jadwal KPP Tegal dong.|link jadwal kpp tegal|.|Apakah ada perbedaan jam layanan di KPP Tegal?|Bedain jam layanan KPP Tegal dong.|beda jam layanan kpp tegal|Segmentasi jam layanan KPP Tegal.|Kapan waktu terbaik untuk mengunjungi KPP Tegal?|Wktu yg enak ke KPP Tegal kpn?|waktu enak ke kpp tegal|Rekomendasi slot waktu kunjung KPP Tegal.|Apakah jam operasional KPP Tegal berbeda di akhir pekan?|KPP Tegal buka di weekend ga?|kpp tegal weekend buka?|Jadwal weekend KPP Tegal.|Bagaimana prosedur layanan di KPP Tegal?|Klo mau urus kantor PDAM di KPP Tegal gimana?|urus kantor PDAM di kpp tegal gmn?|Tata cara layanan KPP Tegal.|Apakah KPP Tegal melayani di luar jam kerja?|KPP Tegal ada layanan after hour ga?|kpp tegal layanan after hour?|Layanan after hour KPP Tegal.Kapankah jam layanan kantor PDAM Tegal dimulai?|kantor PDAM Tegal jam berapa buka?|kntor kantor PDAM tegal buka jam?|Cek jadwal operasional kantor PDAM Tegal.|Bisakah saya mengetahui jadwal operasional kantor PDAM Tegal?|kantor PDAM Tegal buka dr jam brp?|kantor PDAM tegal buka jam brp?|Info jam layanan kantor PDAM Pratama Tegal.|Pada pukul berapa kantor PDAM Tegal memulai kegiatannya?|Ada yg tau jadwal buka kantor PDAM Tegal?|kantor PDAM tegal buka kpn?|Akses jam kerja kantor PDAM Tegal.|Mohon informasikan waktu kerja kantor PDAM Tegal.|kantor PDAM Tegal buka skrg?|kantor PDAM tegal buka ga skrg?|Update status buka kantor PDAM Tegal.|Sampai pukul berapa kantor PDAM Tegal melayani?|kantor PDAM Tegal sampe jam berapa?|kantor PDAM tegal tutup jam?|Waktu tutup layanan kantor PDAM Tegal.|Apakah kantor PDAM Tegal buka pada hari Sabtu?|kantor PDAM Tegal weekend buka ga?|kantor PDAM tegal sabtu buka?|Jadwal weekend kantor PDAM Tegal.|Dimana saya bisa melihat jadwal kantor PDAM Tegal?|Link jadwal kantor PDAM Tegal dong.|link jadwal kantor PDAM tegal|Bagaimana prosedur layanan di kantor PDAM Tegal?|Klo mau bayar kantor PDAM di Tegal gimana?|byr kantor PDAM di tegal gmn?|Tata cara layanan kantor PDAM Tegal.|Apakah ada layanan darurat di kantor PDAM Tegal?|kantor PDAM Tegal ada layanan cepat?|kantor PDAM tegal layanan cepat?|Layanan ekspres kantor PDAM Tegal.|Kapan waktu yang tepat untuk datang ke kantor PDAM Tegal?|Wktu yg ga rame ke kantor PDAM Tegal kpn?|wkt sepi ke kantor PDAM tegal|Rekomendasi slot kunjung kantor PDAM Tegal.|Apakah jam layanan KPP dan kantor PDAM Tegal sama?|Beda ga jamnya KPP sama kantor PDAM?|beda jam kpp sm kantor PDAM?|Bisakah mendapatkan layanan kantor PDAM Tegal secara online?|Bisa urus kantor PDAM Tegal online ga?|urus kantor PDAM tegal online?|Layanan digital kantor PDAM Tegal.|Bagaimana kondisi antrian di kantor PDAM Tegal?|Antrian di kantor PDAM Tegal rame ga?|antrian kantor PDAM tegal|Monitoring antrian kantor PDAM Tegal.|Apakah kantor PDAM Tegal tutup pada hari libur nasional?|kantor PDAM Tegal libur nasional tutup kan?|kantor PDAM tegal libur nasional?|Kalender libur kantor PDAM Tegal.",static,jam layanan Kantor pajak Tegal setiap hari Rabu pukul 08.00 - 12.00 WIB
pdam_info,"kapan kantor PDAM buka|kantor PDAM buka jam berapa|kantor PDAM buka jam?|jam berapa sih kantor PDAM buka|kantor PDAM buka jam berapa|jadwal operasional kantor PDAM|kapan kantor PDAM buka|jam kerja kantor PDAM|layanan kantor PDAM sampai jam berapa|pukul berapa kantor PDAM beroperasi|info jam buka kantor PDAM|jam buka kantor PDAM|kantor PDAM tutup jam berapa|kantor PDAM melayani sampai pukul berapa|kapan PDAM Tegal buka|PDAM tegal buka jam berapa|PDAM tegal buka jam?|jam berapa sih PDAM buka|PDAM tegal buka jam berapa|jadwal operasional PDAM tegal|kapan PDAM tegal buka|jam kerja PDAM tegal|layanan PDAM tegal sampai jam berapa|pukul berapa PDAM tegal beroperasi|info jam buka PDAM tegal|jam buka PDAM tegal|PDAM tegal tutup jam berapa|PDAM tegal melayani sampai pukul berapa|Kapan Kantor Pelayanan PDAM Tegal membuka layanannya?|kantor pdam Tegal buka jam brp?|kntor pjak tegal buka jm brp?|Cek jadwal operasional kantor pdam Tegal.|Bolehkah saya mengetahui jam operasional kantor pdam Tegal?|PDAM Tegal buka dr jam brp?|kpan kntor PDAM tegal buka?|Info jam layanan kantor pdam Pratama Tegal.|Pada pukul berapa kantor pdam Tegal memulai operasionalnya?|Ada yg tau jadwal buka kantor pdam Tegal?|PDAM tegal buka jam?|Akses jam kerja kantor pdam Tegal.|Kapankah jam layanan kantor pdam Tegal dimulai?|kantor pdam Tegal jam berapa buka nya?|jam brp PDAM tegal?|Update jadwal buka kantor pdam Tegal.|Bisakah Anda menyampaikan jadwal buka kantor pdam Tegal?|Kalo mau ke kantor pdam Tegal bukanya jam berapa?|kantor pdam tegal buka jam?|Cek availability kantor pdam Tegal.|Mohon informasikan jam kerja kantor pdam Tegal.|kantor pdam Tegal buka skrg?|jam buka PDAM tegal?|Jadwal customer service kantor pdam Tegal.|Pukul berapa kantor pdam Tegal tutup?|kantor pdam Tegal tutup jam brp?|kantor pdam tegal tutup jam brp?|Waktu tutup operasional kantor pdam Tegal.|Sampai pukul berapa kantor pdam Tegal melayani wajib PDAM?|kantor pdam Tegal sampe jam berapa?|sampai jam brp kantor pdam tegal?|Jam layanan kantor pdam Tegal hari ini.|Apakah kantor pdam Tegal buka pada hari ini?|kantor pdam Tegal lg buka ga sih?|kantor pdam tegal buka ga?|Status buka/tutup kantor pdam Tegal real-time.|Dimana saya dapat menemukan jadwal kantor pdam Tegal?|Link jadwal kantor pdam Tegal dong.|link jadwal kantor pdam tegal|Apakah ada perbedaan jam layanan di kantor pdam Tegal?|Bedain jam layanan kantor pdam Tegal dong.|beda jam layanan kantor pdam tegal|Segmentasi jam layanan kantor pdam Tegal.|Kapan waktu terbaik untuk mengunjungi kantor pdam Tegal?|Wktu yg enak ke kantor pdam Tegal kpn?|waktu enak ke kantor pdam tegal|Rekomendasi slot waktu kunjung kantor pdam Tegal.|Apakah jam operasional kantor pdam Tegal berbeda di akhir pekan?|kantor pdam Tegal buka di weekend ga?|kantor pdam tegal weekend buka?|Jadwal weekend kantor pdam Tegal.|Bagaimana prosedur layanan di kantor pdam Tegal?|Klo mau urus PDAM di kantor pdam Tegal gimana?|urus PDAM di kantor pdam tegal gmn?|Tata cara layanan kantor pdam Tegal.|Apakah kantor pdam Tegal melayani di luar jam kerja?|kantor pdam Tegal ada layanan after hour ga?|kantor pdam tegal layanan after hour?|Layanan after hour kantor pdam Tegal.Kapankah jam layanan PDAM Tegal dimulai?|PDAM Tegal jam berapa buka?|kntor PDAM tegal buka jam?|Cek jadwal operasional PDAM Tegal.|Bisakah saya mengetahui jadwal operasional PDAM Tegal?|PDAM Tegal buka dr jam brp?|PDAM tegal buka jam brp?|Info jam layanan PDAM Pratama Tegal.|Pada pukul berapa PDAM Tegal memulai kegiatannya?|Ada yg tau jadwal buka PDAM Tegal?|PDAM tegal buka kpn?|Akses jam kerja PDAM Tegal.|Mohon informasikan waktu kerja PDAM Tegal.|PDAM Tegal buka skrg?|PDAM tegal buka ga skrg?|Update status buka PDAM Tegal.|Sampai pukul berapa PDAM Tegal melayani?|PDAM Tegal sampe jam berapa?|PDAM tegal tutup jam?|Waktu tutup layanan PDAM Tegal.|Apakah PDAM Tegal buka pada hari Sabtu?|PDAM Tegal weekend buka ga?|PDAM tegal sabtu buka?|Jadwal weekend PDAM Tegal.|Dimana saya bisa melihat jadwal PDAM Tegal?|Link jadwal PDAM Tegal dong.|link jadwal PDAM tegal|Bagaimana prosedur layanan di PDAM Tegal?|Klo mau bayar PDAM di Tegal gimana?|byr PDAM di tegal gmn?|Tata cara layanan PDAM Tegal.|Apakah ada layanan darurat di PDAM Tegal?|PDAM Tegal ada layanan cepat?|PDAM tegal layanan cepat?|Layanan ekspres PDAM Tegal.|Kapan waktu yang tepat untuk datang ke PDAM Tegal?|Wktu yg ga rame ke PDAM Tegal kpn?|wkt sepi ke PDAM tegal|Rekomendasi slot kunjung PDAM Tegal.|Apakah jam layanan kantor pdam dan PDAM Tegal sama?|Beda ga jamnya kantor pdam sama PDAM?|beda jam kantor pdam sm PDAM?|Bisakah mendapatkan layanan PDAM Tegal secara online?|Bisa urus PDAM Tegal online ga?|urus PDAM tegal online?|Layanan digital PDAM Tegal.|Bagaimana kondisi antrian di PDAM Tegal?|Antrian di PDAM Tegal rame ga?|antrian PDAM tegal|Monitoring antrian PDAM Tegal.|Apakah PDAM Tegal tutup pada hari libur nasional?|PDAM Tegal libur nasional tutup kan?|PDAM tegal libur nasional?|Kalender libur PDAM Tegal.",static,jam layanan PDAM setiap hari Senin - Jumat pukul 08.00 - 14.00 WIB
